{"ast_inventory":{"entries":[{"api":"subprocess.run","id":"unsafe-api-bootstrap-088","line":88,"path":"src/quarry_recon/bootstrap.py"},{"api":"subprocess.run","id":"unsafe-api-bootstrap-100","line":100,"path":"src/quarry_recon/bootstrap.py"},{"api":"subprocess.run","id":"unsafe-api-bootstrap-171","line":171,"path":"src/quarry_recon/bootstrap.py"},{"api":"subprocess.run","id":"unsafe-api-bootstrap-556","line":556,"path":"src/quarry_recon/bootstrap.py"},{"api":"subprocess.run","id":"unsafe-api-bootstrap-608","line":608,"path":"src/quarry_recon/bootstrap.py"},{"api":"subprocess.run","id":"unsafe-api-cgroup-042","line":42,"path":"src/quarry_recon/cgroup.py"},{"api":"yaml.load","id":"unsafe-api-nuclei-policy-315","line":315,"path":"src/quarry_recon/nuclei_policy.py"},{"api":"subprocess.run","id":"unsafe-api-registry-256","line":256,"path":"src/quarry_recon/registry.py"},{"api":"subprocess.run","id":"unsafe-api-registry-330","line":330,"path":"src/quarry_recon/registry.py"},{"api":"subprocess.run","id":"unsafe-api-registry-363","line":363,"path":"src/quarry_recon/registry.py"},{"api":"subprocess.run","id":"unsafe-api-registry-937","line":937,"path":"src/quarry_recon/registry.py"},{"api":"subprocess.run","id":"unsafe-api-registry-1573","line":1573,"path":"src/quarry_recon/registry.py"},{"api":"subprocess.run","id":"unsafe-api-release-evidence-327","line":327,"path":"src/quarry_recon/release_evidence.py"},{"api":"subprocess.Popen","id":"unsafe-api-release-h0-592","line":592,"path":"src/quarry_recon/release_h0.py"},{"api":"subprocess.Popen","id":"unsafe-api-runner-1230","line":1230,"path":"src/quarry_recon/runner.py"}],"source_roster":["src/quarry_recon"]},"bandit":{"confidence":"HIGH","exceptions":{"digest":"sha256:4a8702da779c9e78225a058542ddbc042f4e538f3e7bea7e35b665795301e8bf","path":"release/evidence/security-exceptions-v1.json"},"severity":"HIGH","source_roster":["src"],"tool":"bandit","version":"1.9.4"},"dependency_manifest":{"digest":"sha256:6664adeb4b51387b2fb93d10c2968cbf10a6647bcc6968cd8a9d8441cbad7b9a","path":"pyproject.toml"},"detect_secrets":{"baseline":{"digest":"sha256:349835ff89a2910b77be24f96b5d5131fab7b9e02f6c8bb0ba57c17994a4aabb","path":".secrets.baseline"},"mode":"tracked-files","tool":"detect-secrets","version":"1.5.0"},"h0_property_tests":{"nodes":["tests/test_config.py::TestProfileLoad::test_valid_profile_loads","tests/test_phase1_privfs_core.py::test_strict_walk_refuses_a_symlink_at_every_directory_depth[1]","tests/test_release_h0.py::test_tool_open_refuses_relative_or_non_normalized_paths[git]"],"sources":["tests/test_config.py","tests/test_phase1_privfs_core.py","tests/test_release_h0.py"]},"release":"0.3.10","schema_version":"quarry.static-security-policy.v1","unsafe_apis":["subprocess.Popen","subprocess.run","yaml.load"]}
